{
  "$schema": "https://json-schema.org/draft/2020-12/schema",
  "$id": "https://dabbler.ai/schemas/benchmark-registration.schema.json",
  "title": "BenchmarkRegistration",
  "description": "Set 069 S5 - the PRE-REGISTERED benchmark for the measured replacement gate. Written as benchmark-registration.json BEFORE the automated surface is scored, so the pass thresholds cannot be moved to fit the result. Mixes seeded defect classes with holdout cases (recent real misses, e.g. the two Major bugs the 0.22.0 automated run missed) so the benchmark measures the actual manual-vs-automated gap. minCasesForPower records the n below which a result is reported underpowered rather than silently passed. The runtime contract is the pure-Python validator ai_router.replacement_gate.validate_benchmark_registration; ai_router.replacement_gate.score_benchmark derives recall/precision/replay-success/false-REPRODUCED and the cadence recommendation. See docs/proposals/2026-06-16-pull-architecture-capabilities/proposal.md Sec.1.6.",
  "type": "object",
  "additionalProperties": false,
  "required": ["schemaVersion", "name", "registeredAt", "thresholds", "cases"],
  "properties": {
    "schemaVersion": { "type": "integer", "enum": [1] },
    "name": {
      "description": "A stable benchmark name. The scoreboard's benchmarkName must match it (identity).",
      "type": "string",
      "minLength": 1,
      "pattern": "\\S"
    },
    "registeredAt": {
      "description": "ISO-8601 timestamp of pre-registration (before scoring).",
      "type": "string",
      "minLength": 1,
      "pattern": "\\S"
    },
    "minCasesForPower": {
      "description": "The minimum real-case count for a powered result. Below this, score_benchmark reports underpowered=true and meets_thresholds is forced False. Default 10.",
      "type": "integer",
      "minimum": 1
    },
    "notes": { "type": "string" },
    "thresholds": {
      "type": "object",
      "description": "The pass bar, committed before scoring. recall/precision/replaySuccess are minimums; maxFalseReproducedRate is a maximum. All are numbers in [0, 1].",
      "additionalProperties": true,
      "required": ["recall", "precision", "replaySuccess", "maxFalseReproducedRate"],
      "properties": {
        "recall": { "type": "number", "minimum": 0, "maximum": 1 },
        "precision": { "type": "number", "minimum": 0, "maximum": 1 },
        "replaySuccess": { "type": "number", "minimum": 0, "maximum": 1 },
        "maxFalseReproducedRate": { "type": "number", "minimum": 0, "maximum": 1 }
      }
    },
    "cases": {
      "description": "The benchmark cases (real defects the surface should catch). At least one, and at least one of kind 'holdout'.",
      "type": "array",
      "minItems": 1,
      "items": { "$ref": "#/$defs/BenchmarkCase" }
    }
  },
  "$defs": {
    "BenchmarkCase": {
      "type": "object",
      "additionalProperties": true,
      "required": ["id", "kind", "defectClass", "description"],
      "properties": {
        "id": { "type": "string", "minLength": 1, "pattern": "\\S" },
        "kind": {
          "description": "'seeded' = a known/injected defect class; 'holdout' = a recent real miss (the gap the benchmark must measure).",
          "type": "string",
          "enum": ["seeded", "holdout"]
        },
        "defectClass": { "type": "string", "minLength": 1, "pattern": "\\S" },
        "description": { "type": "string", "minLength": 1, "pattern": "\\S" },
        "probeable": {
          "description": "Whether a deterministic probe can falsify this class (advisory).",
          "type": "boolean"
        },
        "sourceRef": {
          "description": "For a holdout case, the real miss it came from (e.g. a commit / release / incident ref).",
          "type": "string"
        }
      }
    }
  }
}
