{
  "schemaVersion": 1,
  "name": "pull-critique-replacement-2026-06",
  "registeredAt": "2026-06-16T11:00:00-04:00",
  "minCasesForPower": 10,
  "notes": "Pre-registered BEFORE scoring. Seeded classes plus holdout cases drawn from the 0.22.0 automated-run misses (the gap this set closes).",
  "thresholds": {
    "recall": 0.85,
    "precision": 0.8,
    "replaySuccess": 0.9,
    "maxFalseReproducedRate": 0.05
  },
  "cases": [
    {
      "id": "S1",
      "kind": "seeded",
      "defectClass": "unicode-on-malformed-bytes",
      "description": "A JSON reader crashes on invalid UTF-8 instead of returning not-ok",
      "probeable": true
    },
    {
      "id": "S2",
      "kind": "seeded",
      "defectClass": "mkdtemp-escapes-try-finally",
      "description": "A temp dir is created before the try/finally so cleanup can leak on failure",
      "probeable": true
    },
    {
      "id": "H1",
      "kind": "holdout",
      "defectClass": "run_test-mkdtemp-leak",
      "description": "The Major bug the 0.22.0 automated run missed: run_test mkdtemp escaped the try/finally",
      "probeable": true,
      "sourceRef": "ai_router 0.22.0 post-release manual critique"
    },
    {
      "id": "H2",
      "kind": "holdout",
      "defectClass": "contract_gate-unicode",
      "description": "The second Major bug the 0.22.0 automated run missed: contract_gate did not guard UnicodeError",
      "probeable": true,
      "sourceRef": "ai_router 0.22.0 post-release manual critique"
    }
  ]
}
